{"adapter":"physics","agents":["f1"],"code_revision":"c527a1960452e83293f11cfcf9cb358dbf464add","dt_s":0.01,"events":[{"agent":"f1","detail":{"source":"mission"},"kind":"authority_change","time_s":0.02},{"agent":"f1","detail":{"distance_m":0.995553},"kind":"tag_zone_enter","time_s":4.09},{"agent":"f1","detail":{"distance_m":1.002434},"kind":"tag_zone_exit","time_s":5.67},{"agent":"f1","detail":{"distance_m":0.998065},"kind":"tag_zone_enter","time_s":7.18},{"agent":"f1","detail":{"distance_m":1.002679},"kind":"tag_zone_exit","time_s":8.91},{"agent":"f1","detail":{"distance_m":0.996753},"kind":"tag_zone_enter","time_s":10.62},{"agent":"f1","detail":{"distance_m":1.000385},"kind":"tag_zone_exit","time_s":11.98},{"agent":"f1","detail":{"distance_m":0.998106},"kind":"tag_zone_enter","time_s":13.3},{"agent":"f1","detail":{"distance_m":1.000921},"kind":"tag_zone_exit","time_s":14.77},{"agent":"f1","detail":{"distance_m":0.997043},"kind":"tag_zone_enter","time_s":16.33},{"agent":"f1","detail":{"distance_m":1.001228},"kind":"tag_zone_exit","time_s":17.67},{"agent":"f1","detail":{"distance_m":0.997164},"kind":"tag_zone_enter","time_s":19.15},{"agent":"f1","detail":{"distance_m":1.002247},"kind":"tag_zone_exit","time_s":20.42},{"agent":"f1","detail":{"clipped_m":[15.5,4.885201,1.617343],"requested_m":[15.506207,4.885201,1.617343]},"kind":"geofence_clip","time_s":23.46},{"agent":"f1","detail":{"clipped_m":[15.5,4.962928,1.448408],"requested_m":[16.107495,4.962928,1.448408]},"kind":"geofence_clip","time_s":24.46},{"agent":"f1","detail":{"clipped_m":[15.5,4.98839,1.490786],"requested_m":[16.286093,4.98839,1.490786]},"kind":"geofence_clip","time_s":25.46},{"agent":"f1","detail":{"clipped_m":[15.5,4.999044,1.433035],"requested_m":[16.821647,4.999044,1.433035]},"kind":"geofence_clip","time_s":26.46},{"agent":"f1","detail":{"clipped_m":[15.5,5.11772,1.499647],"requested_m":[17.318211,5.11772,1.499647]},"kind":"geofence_clip","time_s":27.46},{"agent":"f1","detail":{"clipped_m":[15.5,4.990123,1.350321],"requested_m":[17.841798,4.990123,1.350321]},"kind":"geofence_clip","time_s":28.46},{"agent":"f1","detail":{"clipped_m":[15.5,4.919742,1.482899],"requested_m":[18.395928,4.919742,1.482899]},"kind":"geofence_clip","time_s":29.46},{"agent":null,"detail":{"reason":"timeout"},"kind":"mission_end","time_s":30.0}],"frames":{"agents":{"f1":{"authority":["none","mission","mission","mission","mission","mission","mission","mission","mission","mission","mission","mission","mission","mission","mission","mission","mission","mission","mission","mission","mission","mission","mission","mission","mission","mission","mission","mission","mission","mission","mission","mission","mission","mission","mission","mission","mission","mission","mission","mission","mission","mission","mission","mission","mission","mission","mission","mission","mission","mission","mission","mission","mission","mission","mission","mission","mission","mission","mission","mission","mission","mission","mission","mission","mission","mission","mission","mission","mission","mission","mission","mission","mission","mission","mission","mission","mission","mission","mission","mission","mission","mission","mission","mission","mission","mission","mission","mission","mission","mission","mission","mission","mission","mission","mission","mission","mission","mission","mission","mission","mission","mission","mission","mission","mission","mission","mission","mission","mission","mission","mission","mission","mission","mission","mission","mission","mission","mission","mission","mission","mission","mission","mission","mission","mission","mission","mission","mission","mission","mission","mission","mission","mission","mission","mission","mission","mission","mission","mission","mission","mission","mission","mission","mission","mission","mission","mission","mission","mission","mission","mission","mission","mission","mission","mission","mission","mission","mission","mission","mission","mission","mission","mission","mission","mission","mission","mission","mission","mission","mission","mission","mission","mission","mission","mission","mission","mission","mission","mission","mission","mission","mission","mission","mission","mission","mission","mission","mission","mission","mission","mission","mission","mission","mission","mission","mission","mission","mission","mission","mission","mission","mission","mission","mission","mission","mission","mission","mission","mission","mission","mission","mission","mission","mission","mission","mission","mission","mission","mission","mission","mission","mission","mission","mission","mission","mission","mission","mission","mission","mission","mission","mission","mission","mission","mission","mission","mission","mission","mission","mission","mission","mission","mission","mission","mission","mission","mission","mission","mission","mission","mission","mission","mission","mission","mission","mission","mission","mission","mission","mission","mission","mission","mission","mission","mission","mission","mission","mission","mission","mission","mission","mission","mission","mission","mission","mission","mission","mission","mission","mission","mission","mission","mission","mission","mission","mission","mission","mission","mission","mission","mission","mission","mission","mission","mission","mission","mission","mission","mission","mission","mission","mission","mission","mission","mission","mission","mission","mission","mission","mission","mission","mission","mission","mission","mission","mission","mission","mission","mission","mission","mission","mission","mission","mission","mission","mission","mission","mission","mission","mission","mission","mission","mission","mission","mission","mission","mission","mission","mission","mission","mission","mission","mission","mission","mission","mission","mission","mission","mission","mission","mission","mission","mission","mission","mission","mission","mission","mission","mission","mission","mission","mission","mission","mission","mission","mission","mission","mission","mission","mission","mission","mission","mission","mission","mission","mission","mission","mission","mission","mission","mission","mission","mission","mission","mission","mission","mission","mission","mission","mission","mission","mission","mission","mission","mission","mission","mission","mission","mission","mission","mission","mission","mission","mission","mission","mission","mission","mission","mission","mission","mission","mission","mission","mission","mission","mission","mission","mission","mission","mission","mission","mission","mission","mission","mission","mission","mission","mission","mission","mission","mission","mission","mission","mission","mission","mission","mission","mission","mission","mission","mission","mission","mission","mission","mission","mission","mission","mission","mission","mission","mission","mission","mission","mission","mission","mission","mission","mission","mission","mission","mission","mission","mission","mission","mission","mission","mission","mission","mission","mission","mission","mission","mission","mission","mission","mission","mission","mission","mission","mission","mission","mission","mission","mission","mission","mission","mission","mission","mission","mission","mission","mission","mission","mission","mission","mission","mission","mission","mission","mission","mission","mission","mission","mission","mission","mission","mission","mission","mission","mission","mission","mission","mission","mission","mission","mission","mission","mission","mission","mission","mission","mission","mission","mission","mission","mission","mission","mission","mission","mission","mission","mission","mission","mission","mission","mission","mission","mission","mission","mission","mission","mission","mission","mission","mission","mission","mission","mission","mission","mission","mission","mission","mission","mission","mission","mission","mission","mission","mission","mission","mission","mission","mission","mission","mission","mission","mission","mission","mission","mission","mission","mission","mission","mission","mission","mission","mission","mission","mission","mission","mission","mission","mission","mission","mission","mission","mission","mission","mission","mission","mission","mission","mission","mission","mission","mission","mission","mission","mission","mission","mission"],"estimate_age_s":[null,null,0.1,0.15,0.1,0.15,0.1,0.15,0.1,0.15,0.1,0.15,0.1,0.15,0.1,0.15,0.1,0.15,0.1,0.15,0.1,0.15,0.1,0.15,0.1,0.15,0.1,0.15,0.1,0.15,0.1,0.15,0.1,0.15,0.1,0.15,0.1,0.15,0.1,0.15,0.1,0.15,0.1,0.15,0.1,0.15,0.1,0.15,0.1,0.15,0.1,0.15,0.1,0.15,0.1,0.15,0.1,0.15,0.1,0.15,0.1,0.15,0.1,0.15,0.1,0.15,0.1,0.15,0.1,0.15,0.1,0.15,0.1,0.15,0.1,0.15,0.1,0.15,0.1,0.15,0.1,0.15,0.1,0.15,0.1,0.15,0.1,0.15,0.1,0.15,0.1,0.15,0.1,0.15,0.1,0.15,0.1,0.15,0.1,0.15,0.1,0.15,0.1,0.15,0.1,0.15,0.1,0.15,0.1,0.15,0.1,0.15,0.1,0.15,0.1,0.15,0.1,0.15,0.1,0.15,0.1,0.15,0.1,0.15,0.1,0.15,0.1,0.15,0.1,0.15,0.1,0.15,0.1,0.15,0.1,0.15,0.1,0.15,0.1,0.15,0.1,0.15,0.1,0.15,0.1,0.15,0.1,0.15,0.1,0.15,0.1,0.15,0.1,0.15,0.1,0.15,0.1,0.15,0.1,0.15,0.1,0.15,0.1,0.15,0.1,0.15,0.1,0.15,0.1,0.15,0.1,0.15,0.1,0.15,0.1,0.15,0.1,0.15,0.1,0.15,0.1,0.15,0.1,0.15,0.1,0.15,0.1,0.15,0.1,0.15,0.1,0.15,0.1,0.15,0.1,0.15,0.1,0.15,0.1,0.15,0.1,0.15,0.1,0.15,0.1,0.15,0.1,0.15,0.1,0.15,0.1,0.15,0.1,0.15,0.1,0.15,0.1,0.15,0.1,0.15,0.1,0.15,0.1,0.15,0.1,0.15,0.1,0.15,0.1,0.15,0.1,0.15,0.1,0.15,0.1,0.15,0.1,0.15,0.1,0.15,0.1,0.15,0.1,0.15,0.1,0.15,0.1,0.15,0.1,0.15,0.1,0.15,0.1,0.15,0.1,0.15,0.1,0.15,0.1,0.15,0.1,0.15,0.1,0.15,0.1,0.15,0.1,0.15,0.1,0.15,0.1,0.15,0.1,0.15,0.1,0.15,0.1,0.15,0.1,0.15,0.1,0.15,0.1,0.15,0.1,0.15,0.1,0.15,0.1,0.15,0.1,0.15,0.1,0.15,0.1,0.15,0.1,0.15,0.1,0.15,0.1,0.15,0.1,0.15,0.1,0.15,0.1,0.15,0.1,0.15,0.1,0.15,0.1,0.15,0.1,0.15,0.1,0.15,0.1,0.15,0.1,0.15,0.1,0.15,0.1,0.15,0.1,0.15,0.1,0.15,0.1,0.15,0.1,0.15,0.1,0.15,0.1,0.15,0.1,0.15,0.1,0.15,0.1,0.15,0.1,0.15,0.1,0.15,0.1,0.15,0.1,0.15,0.1,0.15,0.1,0.15,0.1,